Term,Definition
Buffalo Wings,"Spicy chicken wings coated in a tangy, hot sauce, typically served with celery and blue cheese or ranch dressing."
Mozzarella Sticks,"Breaded and fried mozzarella cheese, served with marinara sauce for dipping."
Nachos,"Tortilla chips topped with melted cheese, jalapeños, and often meats, beans, or salsa, served with sour cream and guacamole."
Deviled Eggs,"Hard-boiled eggs halved, with yolks mixed with mayonnaise, mustard, and spices, then piped back into the whites."
Spinach Artichoke Dip,"Creamy dip made with spinach, artichoke hearts, cream cheese, and parmesan, served warm with chips or bread."
Bruschetta,"Toasted bread topped with a mixture of diced tomatoes, garlic, basil, and olive oil."
Calamari,"Fried squid rings, lightly breaded, served with marinara sauce or lemon aioli."
Chicken Quesadilla,"Flour tortilla filled with shredded chicken, cheese, and spices, grilled and served with salsa and sour cream."
Shrimp Cocktail,"Chilled shrimp served with a tangy cocktail sauce made from ketchup, horseradish, and lemon."
Stuffed Mushrooms,"Mushroom caps filled with a mixture of breadcrumbs, cheese, garlic, and herbs, then baked."
Potato Skins,"Hollowed potato halves topped with melted cheese, bacon, and green onions, served with sour cream."
Onion Rings,"Sliced onions dipped in batter or breadcrumbs and deep-fried, often served with ketchup or ranch."
Guacamole and Chips,"Mashed avocado mixed with lime, cilantro, onion, and tomato, served with tortilla chips."
Pigs in a Blanket,"Mini sausages wrapped in puff pastry or crescent roll dough and baked until golden."
Jalapeño Poppers,"Jalapeño peppers stuffed with cream cheese or cheddar, breaded, and fried."
Hummus and Pita,"Creamy chickpea dip flavored with tahini, lemon, and garlic, served with soft pita bread."
Crab Cakes,"Patties made from crab meat, breadcrumbs, and seasonings, pan-fried and served with remoulade sauce."
Sliders,"Mini burgers with beef patties, cheese, and toppings like lettuce and tomato, served on small buns."
Chicken Tenders,"Breaded and fried chicken strips, served with dipping sauces like honey mustard or barbecue."
Fried Pickles,"Pickle slices battered and fried, served with ranch or spicy dipping sauce."
Cheese Platter,"Assorted cheeses like cheddar, brie, and gouda, served with crackers, grapes, and nuts."
Meatballs,"Small balls of ground meat, often beef or pork, simmered in tomato sauce or served with a glaze."
Clams Casino,"Baked clams topped with breadcrumbs, bacon, and a buttery herb mixture."
Ahi Tuna Tartare,"Raw, diced tuna mixed with soy sauce, sesame oil, and spices, served with wonton chips."
Fried Green Tomatoes,"Sliced green tomatoes coated in cornmeal or flour and fried, often served with remoulade."
Antipasto Skewers,"Bite-sized skewers with olives, mozzarella, salami, and cherry tomatoes, drizzled with balsamic."
Bacon-Wrapped Scallops,"Sea scallops wrapped in bacon, grilled or baked, and served with a glaze or lemon."
Caprese Salad,"Sliced tomatoes, fresh mozzarella, and basil, drizzled with olive oil and balsamic reduction."
Egg Rolls,"Crispy, fried rolls filled with cabbage, pork, or shrimp, served with sweet and sour sauce."
Ceviche,"Raw fish or shrimp marinated in lime juice with onions, cilantro, and peppers, served chilled."
Pretzel Bites,"Soft, bite-sized pretzels served with warm cheese sauce or mustard."
Fried Mac and Cheese Balls,"Balls of macaroni and cheese, breaded and fried, served with marinara or ranch."
Tater Tots,"Crispy, fried potato nuggets, often served with ketchup or cheese sauce."
Stuffed Bell Peppers,"Mini bell peppers filled with cream cheese, sausage, or spiced rice, then baked."
Baked Brie,"Brie cheese baked until gooey, often topped with jam or nuts, served with crackers."
Shrimp Tempura,"Lightly battered and fried shrimp, served with soy sauce or sweet chili dip."
Chicken Satay,"Grilled chicken skewers marinated in peanut sauce, served with extra sauce for dipping."
Mini Quiches,"Small pastry crusts filled with egg, cheese, and fillings like spinach or bacon, baked until set."
Chips and Salsa,"Tortilla chips paired with a fresh tomato-based salsa with onions, cilantro, and lime."
Garlic Bread,"Sliced bread topped with garlic butter and herbs, toasted until crispy."
Cucumber Bites,"Cucumber slices topped with cream cheese, dill, and smoked salmon or cherry tomatoes."
Fried Zucchini,"Zucchini slices battered and fried, served with marinara or ranch dressing."
Taquitos,"Small corn tortillas rolled with beef or chicken, fried, and served with salsa or guacamole."
Pimento Cheese Dip,"Creamy spread of cheddar, pimentos, and mayonnaise, served with crackers or celery."
Bacon-Wrapped Dates,"Dates stuffed with cheese or almonds, wrapped in bacon, and baked until crispy."
Chili Cheese Fries,"French fries topped with chili and melted cheese, often garnished with onions."
Sausage Balls,"Bite-sized balls of sausage, cheese, and biscuit mix, baked until golden."
Avocado Toast Bites,"Small toasts topped with mashed avocado, tomato, and seasonings like red pepper flakes."
Mini Tacos,"Tiny tortillas filled with seasoned beef, chicken, or fish, topped with lettuce and cheese."
Sweet Potato Fries,"Crispy fried sweet potato sticks, served with a dipping sauce like honey mustard."