term,definition,strand
A study technique emphasizing deep encoding (e.g. mind maps and mnemonics),elaborative rehearsal,1
When a reward is given for doing a behavior for a random amount of time (e.g. waiting for the bus),variable interval schedule,1
Solomon Asch experimented on __________ using lines and a group of confederates all saying the same wrong answer,Conformity,1
The in ability to recall old information.  Usually associated with dementia.,Retrograde amnesia,1
The building blocks of chromosomes.  (Among other things) They code for proteins,genes,1
"The third stage in Piaget’s theory of cognitive development, the stage where logical thought is developed.",concrete operational stage,1
The part of the neuron that receives signals,dendrite,1
A study where a hypothesis is tested under controlled conditions with a clear independent & dependent variable,experiment,1
Twins that are genetically uniform and develop from a single fertilized egg which later splits,identical twins,1
The most frequently occurring score in a distribution,mode,1
All sensory information (except smell) is routed through this limbic structure,Thalamus,
"An unjustified, negative attitude toward a group outside of yours.",prejudice,
Where a person retrieves information that they have learned before e.g. a fill in the blank test,recall,
"The first stage in Piaget’s cognitive development theory, where infants learn the world through senses.",sensorimotor,
When a reward is given for doing a behavior for a set amount of time (e.g. paid by the hour),fixed interval schedule,
Erik Eriksen's most important stage of psychosocial development,identity v role confusion,
The belief that outside forces decide our fate and what happens in our lives is out of our control.,external locus of control,
The process of observing and copying a behavior,Modeling,
The stage of Piaget’s theory where children learn how to use language but do not understand logic yet.,Preoperational stage,
The theory that altruism was programmed into us over millions of years to promote and reward cooperation,Reciprocal altruism,
"An individual’s ""natural"" weight.  Largely determined by genetics",set point,
A technique for gaining people’s self-reported attitudes by questioning a random sample of people.,survey,
"The ""internal"" sense of touch; knowing your movements and position",kinesthesis,
learned response to a previous neutral stimulus that is now the conditioned stimulus,conditioned stimulus,
This is the part of the eye where there are no receptor cells.,blind spot,
The measured outcome of an experiment,Dependent Variable,
"After repeated exposure to the conditioned stimuli alone, the reponse diminishes.",extinction,
Roles and characteristics that are defined by a culture as male or female.,gender,
This is the perception of a relationship where none exists.,Illusory correlation,
These are used to perceive depth when only using one eye.,Monocular cues,
These are a type of drug that dramatically reduce pain and increase euphoria,opiates,
The observation that information at the beginning and end of lessons is retained better than information in the middle.,primacy-recency effect,
Who you are attracted to and how powerful your sex drive is,sexuality,
This arouses the body in stressful situations (think fight or flight response).,Sympathetic Nervous System,
A device that tests depth perception in infants and young animals.,Visual cliff,
Severing the corpus callosum creates,split brain,
A disorder characterized by persistent feelings of unease and nervousness,Generalized Anxiety Disorder,
Changing behavior to match what others in a situation are doing without any explicit reinforcement,Conformity,
An experiment where both the evaluator and the participants are unaware of wht group they're in,Double Blind Procedure,
A statistical technique to discover the degree to which variables (e.g. personality) clusters together,Factor analysis,
"The body's ""fuel"".  Cells break this down to make ATP",Glucose,
An external reward offered for completing an action,Incentive,
A naturally occurring element used to treat bipolar patients,Lithium,
"The part of the brain that controls simple, voluntary movements",Motor cortex,
A defense mechanism where negative thoughts and/or behaviors are attributed to others rather than yourself,Projection,
A network of neurons in the hindbrain that filters incoming signals and controls arousal,Reticular formation,
Baddley's working memory model includes this temporary mechanism to store images,visuospatial sketchpad,
"In the scientific method, after thorough testing (usually decades), an idea moves from guesswork to",Theory,
"In the 1960s, Stanley Milgram used an infamous experiment with simulated shocks to test",obedience,
Using rewards to incrementally build a simple behavior into a complex behavior,Shaping,
A mental predisposition to notice one aspect of a stimulus and ignore others,Confirmation bias,
Personality disorder where an individual lacks empathy or knowledge of wrongdoing,Antisocial,
A technique where one individual is closely studied in an attempt to demonstrate a principle,Case Study,
Nervous system cells that support neurons,Glial cells,
A projective personality test where the patient is shown an image and asked to make up a story about it,Thematic Apperception Test,
The smallest unit of speech which expresses meaning,Morpheme,
To perform a behavior in hopes of an award,Extrinsic motivation,
A defense mechanism that purposely ignores conscious thoughts of anxiety (e.g. denial),Repression,
Genes are made up of this complex molecule,DNA,
Photoreceptors include rods and,cones,
"The five taste sensations include sweet, salty, bitter, sour and (and maybe oleogustus??)",umami,
A strict behaviorist (e.g. Skinner) would reject attempts to look inside,the black box,
To what degree can experimental results be applied more broadly,Generalizability,
A numerical measure of correlation between -1 and +1,Correlation coefficient,
Average distance between data points in a data set and the mean of the data set,Standard deviation,
"The endocrine system's most influential gland, releases hormones and regulates other endocrine glands",Pituitary,
"The four lobes of the forebrain are occipital, temporal, frontal and",parietal,
Central switching mechanism for sensory information,Thalamus,
"Even though all parts of the brain do everything, some parts are more specialized",localization,
Part of the brain which manages the autonomic features of the fight or flight response,Hypothalamus,
A phenomenon where individuals are less likely to help victims if other onlookers are present,Bystander effect,
After repeated pairing with the UCS the neutral similus changes to the,Conditioned stimulus,
"Disorders in which current consciousness becomes separated from previous memories, thoughts, and feelings.",Dissociative,
A complete set of DNA/Chromosomes/genes for a person,Genome,
Structure behind pupil which changes shape to focus images on the retina,Lens,
"The stage of sleep in which most dreaming occurs, especially storylike dreaming",REM,
The prominent sex hormone in males,Testosterone,
The final stage in the stress response cycle,exhaustion,
Portion of the cerebral cortex lying roughly above the ears; includes the auditory areas,Temporal Lobes,
"Sense of body position and movement, including the sense of balance",Vestibular Sense,
An eating disorder characterized by alternating between periods of binge eating and fasting,Bulimia,
A defense mechanism characterized by shifting aggressive impulses toward a more acceptable target,Displacement,
A defense mechanism characterized by shifting aggressive impulses toward a more acceptable target,Experiment,
The extent to which a test yields consistent results,Reliability,
"The formal, scientific word for the sense of hearing",Audition,
Connects the hemispheres of the brain,Corpus Callosum,
"The inability of a young child to see another person’s point of view,",egocentrism,
A condition where one struggles to get enough sleep or to fall asleep,insomnia,
The middle number in a data set.  Half of the points fall above or below regardless of skew,Median,
The debate between the influence of hereditary and environmental factors on development,nature-nurture,
The quality of sound where one can determine “high” and “low” sounds,Tone,
a small gap at the end of a neuron that allows a signal to pass from one neuron to the next,Synapse,
"Walking and chewing are ________, but voluntary processes",nonconscious,
__________ personality disorder cannot take criticism and believes they are the best at everything,narcissistic,
"Studies physical, cognitive, and social change throughout a person's life",Developmental Psychology,
"The idea that mental ability can be reduced to one, simple metric.  IQ is an example",General Intelligence,
A healthy relationship between toddler and parent,secure attachment,
Learning that is not apparent until there is an opportunity or incentive to demonstrate it,Latent Learning,
"In language, the smallest unit that carries meaning (ex: prefix)",Syntax,
Unexpected and repeated episodes of fear,Panic Disorder,
